[
  {
    "id": "1763135961081",
    "filename": "1763135960961-resume.pdf",
    "sourceLink": "https://drive.google.com/uc?export=download&id=1QeYrhpXodmbOfmqYIy_TSL1lN8UHqeJC",
    "name": "Rishabh Jain",
    "email": "rarishabhjain@gmail.com",
    "phone": "7065359624",
    "skills": [
      "Programming Languages:  Python",
      "Java",
      "C",
      "C++",
      "JavaScript",
      "SQL",
      "Kotlin",
      "HTML",
      "CSS",
      "Web & Mobile Development:  React.js",
      "Node.js",
      "Express.js",
      "Django",
      "Flask",
      "Android",
      "Cloud & DevOps:  AWS",
      "GCP",
      "Docker",
      "Kubernetes",
      "Jenkins",
      "CI/CD",
      "Git",
      "GitHub",
      "Data & ML Technologies:  Machine Learning",
      "Data Science",
      "Data Analytics",
      "MongoDB",
      "Firebase",
      "API Development",
      "Networking & Systems:  TCP/IP",
      "Operating Systems",
      "Computer Networks",
      "DevOps",
      "Database Management System",
      "Data Science",
      "Machine",
      "Learning",
      "DevOps",
      "Operating Systems",
      "Computer Networks",
      "Data Structures and Algorithms"
    ],
    "experience": "Info Edge India Limited - 99Acres01/2025 – Present\nSoftware Development EngineerNoida, Uttar Pradesh\n•\nDelivered 10+ AI-powered tools for QA and Product team, reducing manual effort and accelerating release cycles.\n•\nLed a team to research and evaluate 15+ AI models, integrating selected solutions into QA workflows and boosting test\ncoverage.\n•\nEngineered and deployed 20+ microservices using React, Spring Boot, Flask, MongoDB, and REST APIs, enabling\nscalable AI integrations across modules.\n•\nPrototyped a voice-enabled AI feature for users, validated in 50+ pilot test cases, enhancing accessibility and showcasing\nproduct innovation.\nEzinore Pvt. Ltd.09/2023 – 11/2023\nCloud Engineer InternNew Delhi, Delhi\n•\nBuilt and optimized cloud infrastructure using AWS, managing services like EC2, DynamoDB, IoT Core, and Lambda to\nsupport growing user demand.\n•\nIntegrated 5 ML APIs to elevate platform insights and responsiveness across user interfaces.\n•\nDevised a resource plan using AWS Pricing Calculator, reducing cloud expenses by 25% while maintaining system\nperformance.\nPROJECTS\nRealtime Chat Application|MERN Stack, Socket.io12/2024\n•\nDeveloped a real-time messaging platform with sub-second latency and offline queueing for 50+ concurrent users.\n•\nIntegrated DiceBear API for randomized avatars and anonymous, auto-expiring chatrooms (15 min inactivity).\n•\nDesigned a dark-themed UI having 15+ options that adapts to user tone via basic NLP sentiment analysis.\nPredictive Maintenance for Industrial Equipment|Python, scikit-learn, Data Visualization07/2024\n•\nTrained a classification model on historical sensor data to forecast equipment failures with 92% accuracy.\n•\nCompared the performance of 5 distinct classification models including Random Forest, XGBoost and SVM, identifying\nXGBoost as superior.\n•\nApplied ensemble strategies with anomaly detection, validated using 10-fold cross-validation.\n•\nIllustrated trends and predictions through 5+ clear data visualizations using matplotlib and seaborn.\nACHIEVEMENTS\n•\nEarned over 100",
    "education": "Maharaja Agrasen Institute of Technology, Delhi12/2021 – 06/2025\nBachelor of Technology in Computer Science and EngineeringCGPA : 9.055\nSachdeva Public School, Delhi04/2020 – 03/2021\nClass XIIPercentage : 95.8",
    "yearsOfExperience": 81,
    "rawText": "\n\nRishabh Jain\n+91 7065359624\n#rarishabhjain@gmail.com\nrishabhjain1ïLinkedIn§Github\nEDUCATION\nMaharaja Agrasen Institute of Technology, Delhi12/2021 – 06/2025\nBachelor of Technology in Computer Science and EngineeringCGPA : 9.055\nSachdeva Public School, Delhi04/2020 – 03/2021\nClass XIIPercentage : 95.8\nSKILLS\nProgramming Languages:  Python, Java, C, C++, JavaScript, SQL, Kotlin, HTML, CSS\nWeb & Mobile Development:  React.js, Node.js, Express.js, Django, Flask, Android\nCloud & DevOps:  AWS, GCP, Docker, Kubernetes, Jenkins, CI/CD, Git, GitHub\nData & ML Technologies:  Machine Learning, Data Science, Data Analytics, MongoDB, Firebase, API Development\nNetworking & Systems:  TCP/IP, Operating Systems, Computer Networks, DevOps\nRelevant Coursework:  Object Oriented Programming System, Database Management System, Data Science, Machine\nLearning, DevOps, Operating Systems, Computer Networks, Data Structures and Algorithms\nEXPERIENCE\nInfo Edge India Limited - 99Acres01/2025 – Present\nSoftware Development EngineerNoida, Uttar Pradesh\n•\nDelivered 10+ AI-powered tools for QA and Product team, reducing manual effort and accelerating release cycles.\n•\nLed a team to research and evaluate 15+ AI models, integrating selected solutions into QA workflows and boosting test\ncoverage.\n•\nEngineered and deployed 20+ microservices using React, Spring Boot, Flask, MongoDB, and REST APIs, enabling\nscalable AI integrations across modules.\n•\nPrototyped a voice-enabled AI feature for users, validated in 50+ pilot test cases, enhancing accessibility and showcasing\nproduct innovation.\nEzinore Pvt. Ltd.09/2023 – 11/2023\nCloud Engineer InternNew Delhi, Delhi\n•\nBuilt and optimized cloud infrastructure using AWS, managing services like EC2, DynamoDB, IoT Core, and Lambda to\nsupport growing user demand.\n•\nIntegrated 5 ML APIs to elevate platform insights and responsiveness across user interfaces.\n•\nDevised a resource plan using AWS Pricing Calculator, reducing cloud expenses by 25% while maintaining system\nperformance.\nPROJECTS\nRealtime Chat Application|MERN Stack, Socket.io12/2024\n•\nDeveloped a real-time messaging platform with sub-second latency and offline queueing for 50+ concurrent users.\n•\nIntegrated DiceBear API for randomized avatars and anonymous, auto-expiring chatrooms (15 min inactivity).\n•\nDesigned a dark-themed UI having 15+ options that adapts to user tone via basic NLP sentiment analysis.\nPredictive Maintenance for Industrial Equipment|Python, scikit-learn, Data Visualization07/2024\n•\nTrained a classification model on historical sensor data to forecast equipment failures with 92% accuracy.\n•\nCompared the performance of 5 distinct classification models including Random Forest, XGBoost and SVM, identifying\nXGBoost as superior.\n•\nApplied ensemble strategies with anomaly detection, validated using 10-fold cross-validation.\n•\nIllustrated trends and predictions through 5+ clear data visualizations using matplotlib and seaborn.\nACHIEVEMENTS\n•\nEarned over 100 skills badges in cloud computing using Google Cloud Platform on Qwiklabs.\n•\nCompleted 1400+ DSA problems across various platforms(Leetcode, GeeksForGeeks, Codechef) in Java.\n•\nAchieved Knight rank on LeetCode with a max contest rating of 1944 over 60+ contests, demonstrating strong problem\nsolving skills.",
    "uploadedAt": "2025-11-14T15:59:21.081Z"
  },
  {
    "id": "1763135984445",
    "filename": "Sushant_verma_Resume.pdf",
    "name": "Sushant Verma",
    "email": "vermasushant041@gmail.com",
    "phone": "7906744723",
    "skills": [
      "Languages:  Python",
      "Java",
      "JavaScript",
      "MERN Stack",
      "Prompt Engineering",
      "Frameworks:  Django",
      "React.js",
      "React Native",
      "Vue.js",
      "Node.js",
      "Bootstrap",
      "Docker",
      "Streamlit",
      "Automation Tools:  N8N",
      "Selenium",
      "Postman",
      "Appium (Basics)",
      "API Testing:  Postman",
      "REST APIs",
      "Status Codes",
      "JSON Handling",
      "Tools:  cursor",
      "Git",
      "Google Cloud Platform",
      "VS Code",
      "PyCharm",
      "Eclipse",
      "GitHub",
      "IntelliJ IDEA",
      "JIRA",
      "Postman",
      "Concepts:  Data Structures",
      "Algorithms",
      "System Design",
      "Soft Skills:  Leadership",
      "Time Management",
      "Public Speaking"
    ],
    "experience": "MIRUS8 July - 10 September 2024\nWeb Developer InternRemote Internship\n•\nOptimized backend systems, reducing API response time by 35 percent, leading to faster data processing.\n•\nEngineered and integrated RESTful APIs, improving system scalability and efficiency by 50 percent.\n•\nCollaborated with cross-functional teams to identify and resolve bugs, enhancing application reliability.\nGeeksForGeeksSeptember 2023 - 2024\nLEAD’23 at NIET\n•\nOrganized and led events with a team to foster community engagement and knowledge sharing.\n•\nConducted technical workshops and coding contests to enhance peer learning.\n•\nPromoted technical content and increased club participation by 40 percent through strategic outreach initiatives.\nProjects\nDSW Website:MERN StackAugust 2023 - October 2023\n•\nDesigned and Innovated a Dean Student Website (DSW) for NIET, improving user experience and system\nfunctionality.\n•\nImplemented a role-based access system for administrators and students, reducing unauthorized access by 90\npercent\n•\nOptimized database queries, improving website performance and reducing load time by 40 percent.\nPersonal Blog:Next.jsMarch 2025\n•\nDeveloped an SEO-optimized personal blog website using Next.js, Tailwind CSS, with responsive design and\nsmooth animations.\n•\nIntegrated markdown-based content management and optimized metadata for improved search visibility and\nperformance.\n•\nFocused on modern UI/UX practices and accessibility for a seamless reading experience across all devices.\nMedical Social Media Platform:MERN Stack, using cursor aiaugust 2025\n•\nDeveloped a professional networking platform for medical students and doctors, similar to LinkedIn, enabling\nknowledge sharing and career growth.\n•\nImplemented features like user profiles, posts, likes, and comments to foster collaboration and community\nengagement.\n•\nIntegrated secure authentication and responsive design, resulting in a 40 percent improvement in user retention.\nCERTIFICATIONS\n•Data Structures - Coursera•OOPs in Java•Algorithmic Toolbox - Coursera\n•Python for Data Science•Python Basics•Java Programming\n•Human-Centered Design•Introduction to AI•Google Cloud Badges",
    "education": "Noida Institute of Engineering TechnologyGreater Noida , India\nBachelor of Technology - Computer Science and Engineering; CGPA: 7.5/10July 2021 – July 2025\nTechnical",
    "yearsOfExperience": 4,
    "rawText": "\n\nSushant Verma\n+91 7906744723|vermasushant041@gmail.com|LinkedIn|GitHub|LeetCode|Portfolio\nEducation\nNoida Institute of Engineering TechnologyGreater Noida , India\nBachelor of Technology - Computer Science and Engineering; CGPA: 7.5/10July 2021 – July 2025\nTechnical Skills\nLanguages:  Python, Java, JavaScript, MERN Stack,Prompt Engineering\nFrameworks:  Django,React.js, React Native, Vue.js, Node.js, Bootstrap, Docker, Streamlit\nAutomation Tools:  N8N,Selenium, Postman, Appium (Basics)\nAPI Testing:  Postman, REST APIs, Status Codes, JSON Handling\nTools:  cursor, Git, Google Cloud Platform, VS Code, PyCharm, Eclipse, GitHub, IntelliJ IDEA, JIRA,Postman\nConcepts:  Data Structures, Algorithms, System Design\nSoft Skills:  Leadership, Time Management, Public Speaking\nExperience\nMIRUS8 July - 10 September 2024\nWeb Developer InternRemote Internship\n•\nOptimized backend systems, reducing API response time by 35 percent, leading to faster data processing.\n•\nEngineered and integrated RESTful APIs, improving system scalability and efficiency by 50 percent.\n•\nCollaborated with cross-functional teams to identify and resolve bugs, enhancing application reliability.\nGeeksForGeeksSeptember 2023 - 2024\nLEAD’23 at NIET\n•\nOrganized and led events with a team to foster community engagement and knowledge sharing.\n•\nConducted technical workshops and coding contests to enhance peer learning.\n•\nPromoted technical content and increased club participation by 40 percent through strategic outreach initiatives.\nProjects\nDSW Website:MERN StackAugust 2023 - October 2023\n•\nDesigned and Innovated a Dean Student Website (DSW) for NIET, improving user experience and system\nfunctionality.\n•\nImplemented a role-based access system for administrators and students, reducing unauthorized access by 90\npercent\n•\nOptimized database queries, improving website performance and reducing load time by 40 percent.\nPersonal Blog:Next.jsMarch 2025\n•\nDeveloped an SEO-optimized personal blog website using Next.js, Tailwind CSS, with responsive design and\nsmooth animations.\n•\nIntegrated markdown-based content management and optimized metadata for improved search visibility and\nperformance.\n•\nFocused on modern UI/UX practices and accessibility for a seamless reading experience across all devices.\nMedical Social Media Platform:MERN Stack, using cursor aiaugust 2025\n•\nDeveloped a professional networking platform for medical students and doctors, similar to LinkedIn, enabling\nknowledge sharing and career growth.\n•\nImplemented features like user profiles, posts, likes, and comments to foster collaboration and community\nengagement.\n•\nIntegrated secure authentication and responsive design, resulting in a 40 percent improvement in user retention.\nCERTIFICATIONS\n•Data Structures - Coursera•OOPs in Java•Algorithmic Toolbox - Coursera\n•Python for Data Science•Python Basics•Java Programming\n•Human-Centered Design•Introduction to AI•Google Cloud Badges",
    "profileLinks": {
      "github": null,
      "linkedin": null,
      "leetcode": null,
      "hackerrank": null,
      "codechef": null,
      "codeforces": null,
      "portfolio": null,
      "other": []
    },
    "uploadedAt": "2025-11-14T15:59:44.445Z"
  },
  {
    "id": "1763136001040",
    "filename": "Sushant_verma_Resume.pdf",
    "name": "Sushant Verma",
    "email": "vermasushant041@gmail.com",
    "phone": "7906744723",
    "skills": [
      "Languages:  Python",
      "Java",
      "JavaScript",
      "MERN Stack",
      "Prompt Engineering",
      "Frameworks:  Django",
      "React.js",
      "React Native",
      "Vue.js",
      "Node.js",
      "Bootstrap",
      "Docker",
      "Streamlit",
      "Automation Tools:  N8N",
      "Selenium",
      "Postman",
      "Appium (Basics)",
      "API Testing:  Postman",
      "REST APIs",
      "Status Codes",
      "JSON Handling",
      "Tools:  cursor",
      "Git",
      "Google Cloud Platform",
      "VS Code",
      "PyCharm",
      "Eclipse",
      "GitHub",
      "IntelliJ IDEA",
      "JIRA",
      "Postman",
      "Concepts:  Data Structures",
      "Algorithms",
      "System Design",
      "Soft Skills:  Leadership",
      "Time Management",
      "Public Speaking"
    ],
    "experience": "MIRUS8 July - 10 September 2024\nWeb Developer InternRemote Internship\n•\nOptimized backend systems, reducing API response time by 35 percent, leading to faster data processing.\n•\nEngineered and integrated RESTful APIs, improving system scalability and efficiency by 50 percent.\n•\nCollaborated with cross-functional teams to identify and resolve bugs, enhancing application reliability.\nGeeksForGeeksSeptember 2023 - 2024\nLEAD’23 at NIET\n•\nOrganized and led events with a team to foster community engagement and knowledge sharing.\n•\nConducted technical workshops and coding contests to enhance peer learning.\n•\nPromoted technical content and increased club participation by 40 percent through strategic outreach initiatives.\nProjects\nDSW Website:MERN StackAugust 2023 - October 2023\n•\nDesigned and Innovated a Dean Student Website (DSW) for NIET, improving user experience and system\nfunctionality.\n•\nImplemented a role-based access system for administrators and students, reducing unauthorized access by 90\npercent\n•\nOptimized database queries, improving website performance and reducing load time by 40 percent.\nPersonal Blog:Next.jsMarch 2025\n•\nDeveloped an SEO-optimized personal blog website using Next.js, Tailwind CSS, with responsive design and\nsmooth animations.\n•\nIntegrated markdown-based content management and optimized metadata for improved search visibility and\nperformance.\n•\nFocused on modern UI/UX practices and accessibility for a seamless reading experience across all devices.\nMedical Social Media Platform:MERN Stack, using cursor aiaugust 2025\n•\nDeveloped a professional networking platform for medical students and doctors, similar to LinkedIn, enabling\nknowledge sharing and career growth.\n•\nImplemented features like user profiles, posts, likes, and comments to foster collaboration and community\nengagement.\n•\nIntegrated secure authentication and responsive design, resulting in a 40 percent improvement in user retention.\nCERTIFICATIONS\n•Data Structures - Coursera•OOPs in Java•Algorithmic Toolbox - Coursera\n•Python for Data Science•Python Basics•Java Programming\n•Human-Centered Design•Introduction to AI•Google Cloud Badges",
    "education": "Noida Institute of Engineering TechnologyGreater Noida , India\nBachelor of Technology - Computer Science and Engineering; CGPA: 7.5/10July 2021 – July 2025\nTechnical",
    "yearsOfExperience": 4,
    "rawText": "\n\nSushant Verma\n+91 7906744723|vermasushant041@gmail.com|LinkedIn|GitHub|LeetCode|Portfolio\nEducation\nNoida Institute of Engineering TechnologyGreater Noida , India\nBachelor of Technology - Computer Science and Engineering; CGPA: 7.5/10July 2021 – July 2025\nTechnical Skills\nLanguages:  Python, Java, JavaScript, MERN Stack,Prompt Engineering\nFrameworks:  Django,React.js, React Native, Vue.js, Node.js, Bootstrap, Docker, Streamlit\nAutomation Tools:  N8N,Selenium, Postman, Appium (Basics)\nAPI Testing:  Postman, REST APIs, Status Codes, JSON Handling\nTools:  cursor, Git, Google Cloud Platform, VS Code, PyCharm, Eclipse, GitHub, IntelliJ IDEA, JIRA,Postman\nConcepts:  Data Structures, Algorithms, System Design\nSoft Skills:  Leadership, Time Management, Public Speaking\nExperience\nMIRUS8 July - 10 September 2024\nWeb Developer InternRemote Internship\n•\nOptimized backend systems, reducing API response time by 35 percent, leading to faster data processing.\n•\nEngineered and integrated RESTful APIs, improving system scalability and efficiency by 50 percent.\n•\nCollaborated with cross-functional teams to identify and resolve bugs, enhancing application reliability.\nGeeksForGeeksSeptember 2023 - 2024\nLEAD’23 at NIET\n•\nOrganized and led events with a team to foster community engagement and knowledge sharing.\n•\nConducted technical workshops and coding contests to enhance peer learning.\n•\nPromoted technical content and increased club participation by 40 percent through strategic outreach initiatives.\nProjects\nDSW Website:MERN StackAugust 2023 - October 2023\n•\nDesigned and Innovated a Dean Student Website (DSW) for NIET, improving user experience and system\nfunctionality.\n•\nImplemented a role-based access system for administrators and students, reducing unauthorized access by 90\npercent\n•\nOptimized database queries, improving website performance and reducing load time by 40 percent.\nPersonal Blog:Next.jsMarch 2025\n•\nDeveloped an SEO-optimized personal blog website using Next.js, Tailwind CSS, with responsive design and\nsmooth animations.\n•\nIntegrated markdown-based content management and optimized metadata for improved search visibility and\nperformance.\n•\nFocused on modern UI/UX practices and accessibility for a seamless reading experience across all devices.\nMedical Social Media Platform:MERN Stack, using cursor aiaugust 2025\n•\nDeveloped a professional networking platform for medical students and doctors, similar to LinkedIn, enabling\nknowledge sharing and career growth.\n•\nImplemented features like user profiles, posts, likes, and comments to foster collaboration and community\nengagement.\n•\nIntegrated secure authentication and responsive design, resulting in a 40 percent improvement in user retention.\nCERTIFICATIONS\n•Data Structures - Coursera•OOPs in Java•Algorithmic Toolbox - Coursera\n•Python for Data Science•Python Basics•Java Programming\n•Human-Centered Design•Introduction to AI•Google Cloud Badges",
    "profileLinks": {
      "github": null,
      "linkedin": null,
      "leetcode": null,
      "hackerrank": null,
      "codechef": null,
      "codeforces": null,
      "portfolio": null,
      "other": []
    },
    "uploadedAt": "2025-11-14T16:00:01.040Z"
  }
]